id,category,name,description,image
BRTN730,toner,TONER BROTHER ORIGINAL TN730 NEGRO,TONER BROTHER ORIGINAL TN730 NEGRO,assets/images/products/toner/generic-box.png
BRTN213M,toner,TONER BROTHER ORIGINAL TN213 MAGENTA,TONER BROTHER ORIGINAL TN213 MAGENTA,assets/images/products/toner/generic-box.png
BRTN213Y,toner,TONER BROTHER ORIGINAL TN213 AMARILLO,TONER BROTHER ORIGINAL TN213 AMARILLO,assets/images/products/toner/generic-box.png
BRTN213C,toner,TONER BROTHER ORIGINAL TN213 CYAN,TONER BROTHER ORIGINAL TN213 CYAN,assets/images/products/toner/generic-box.png
BRTN221Y,toner,TONER BROTHER ORIGINAL TN221 AMARILLO,TONER BROTHER ORIGINAL TN221 AMARILLO,assets/images/products/toner/generic-box.png
BRDR830,toner,"TAMBOR BROTHER DR830, NEGRO, RENDIMIENTO 15,000 PAGS","TAMBOR BROTHER DR830, NEGRO, RENDIMIENTO 15,000 PAGS",assets/images/products/toner/brother-brdr830.png
BRDR620,toner,TAMBOR BROTHER ORIGINAL DR620 NEGRO,TAMBOR BROTHER ORIGINAL DR620 NEGRO,assets/images/products/toner/generic-box.png
BRTN115M,toner,TONER BROTHER ORIGINAL TN115 MAGENTA,TONER BROTHER ORIGINAL TN115 MAGENTA,assets/images/products/toner/brother-brtn115m.png
BRTN250,toner,TONER BROTHER ORIGINAL TN250 NEGRO,TONER BROTHER ORIGINAL TN250 NEGRO,assets/images/products/toner/brother-brtn250.png
BRTN450,toner,TONER BROTHER ORIGINAL TN450 NEGRO,TONER BROTHER ORIGINAL TN450 NEGRO,assets/images/products/toner/brother-brtn450.png
BRTN920XL,toner,"TONER BROTHER TN920XL NEGRO, RENDIMIENTO 6,000 PAGINAS","TONER BROTHER TN920XL NEGRO, RENDIMIENTO 6,000 PAGINAS",assets/images/products/toner/generic-box.png
BRTN439BK,toner,TONER BROTHER ORIGINAL TN439 NEGRO,TONER BROTHER ORIGINAL TN439 NEGRO,assets/images/products/toner/brother-brtn439bk.png
BRTN439Y,toner,TONER BROTHER ORIGINAL TN439 AMARILLO,TONER BROTHER ORIGINAL TN439 AMARILLO,assets/images/products/toner/generic-box.png
BRTN439C,toner,TONER BROTHER ORIGINAL TN439 CYAN,TONER BROTHER ORIGINAL TN439 CYAN,assets/images/products/toner/generic-box.png
BRTN439M,toner,TONER BROTHER ORIGINAL TN439 MAGENTA,TONER BROTHER ORIGINAL TN439 MAGENTA,assets/images/products/toner/generic-box.png
BRTN730,toner,TONER BROTHER ORIGINAL TN730NEGRO,TONER BROTHER ORIGINAL TN730NEGRO,assets/images/products/toner/generic-box.png
BRTN336M,toner,TONER BROTHER ORIGINAL TN336 MAGENTA,TONER BROTHER ORIGINAL TN336 MAGENTA,assets/images/products/toner/generic-box.png
BRTN339C,toner,TONER BROTHER ORIGINAL TN339 CYAN,TONER BROTHER ORIGINAL TN339 CYAN,assets/images/products/toner/generic-box.png
BRDR331CL,toner,TAMBOR BROTHER ORIGINAL DR331CL NEGRO,TAMBOR BROTHER ORIGINAL DR331CL NEGRO,assets/images/products/toner/generic-box.png
BRDR350,toner,TAMBOR BROTHER ORIGINAL DR350 NEGRO,TAMBOR BROTHER ORIGINAL DR350 NEGRO,assets/images/products/toner/generic-box.png
BRDR360,toner,TAMBOR BROTHER ORIGINAL DR360 NEGRO,TAMBOR BROTHER ORIGINAL DR360 NEGRO,assets/images/products/toner/generic-box.png
BRDR223CL,toner,TAMBOR LASER BROTHER DR223CL,TAMBOR LASER BROTHER DR223CL,assets/images/products/toner/generic-box.png
BRTN221C,toner,TONER BROTHER ORIGINAL TN221 CYAN,TONER BROTHER ORIGINAL TN221 CYAN,assets/images/products/toner/generic-box.png
BRTN221M,toner,TONER BROTHER ORIGINAL TN221 MAGENTA,TONER BROTHER ORIGINAL TN221 MAGENTA,assets/images/products/toner/generic-box.png
BRTN221BK,toner,TONER BROTHER ORIGINAL TN221 NEGRO,TONER BROTHER ORIGINAL TN221 NEGRO,assets/images/products/toner/generic-box.png
BRTN330,toner,TONER BROTHER ORIGINAL TN330 NEGRO,TONER BROTHER ORIGINAL TN330 NEGRO,assets/images/products/toner/generic-box.png
BRTN336Y,toner,TONER BROTHER ORIGINAL TN336 AMARILLO,TONER BROTHER ORIGINAL TN336 AMARILLO,assets/images/products/toner/generic-box.png
BRTN336C,toner,TONER BROTHER ORIGINAL TN336 CYAN,TONER BROTHER ORIGINAL TN336 CYAN,assets/images/products/toner/generic-box.png
BRTN336BK,toner,TONER BROTHER ORIGINAL TN336 NEGRO,TONER BROTHER ORIGINAL TN336 NEGRO,assets/images/products/toner/generic-box.png
BRTN339Y,toner,TONER BROTHER ORIGINAL TN339 AMARILLO,TONER BROTHER ORIGINAL TN339 AMARILLO,assets/images/products/toner/generic-box.png
BRTN339M,toner,TONER BROTHER ORIGINAL TN339 MAGENTA,TONER BROTHER ORIGINAL TN339 MAGENTA,assets/images/products/toner/generic-box.png
BRTN339BK,toner,TONER BROTHER ORIGINAL TN339 NEGRO,TONER BROTHER ORIGINAL TN339 NEGRO,assets/images/products/toner/generic-box.png
BRTN360,toner,TONER BROTHER ORIGINAL TN360 NEGRO,TONER BROTHER ORIGINAL TN360 NEGRO,assets/images/products/toner/brother-brtn360.png
BRTN420,toner,TONER BROTHER ORIGINAL TN420 NEGRO,TONER BROTHER ORIGINAL TN420 NEGRO,assets/images/products/toner/generic-box.png
BRTN580,toner,TONER BROTHER ORIGINAL TN580 NEGRO,TONER BROTHER ORIGINAL TN580 NEGRO,assets/images/products/toner/generic-box.png
BRTN620,toner,TONER BROTHER ORIGINAL TN620 NEGRO,TONER BROTHER ORIGINAL TN620 NEGRO,assets/images/products/toner/generic-box.png
BRTN650,toner,TONER BROTHER ORIGINAL TN650 NEGRO,TONER BROTHER ORIGINAL TN650 NEGRO,assets/images/products/toner/generic-box.png
BRTN720,toner,TONER BROTHER ORIGINAL TN720 NEGRO,TONER BROTHER ORIGINAL TN720 NEGRO,assets/images/products/toner/generic-box.png
BRTN925,toner,"TONER BROTHER VALOR TN925 NEGRO, RENDIMIENTO 25,000 PAGINAS","TONER BROTHER VALOR TN925 NEGRO, RENDIMIENTO 25,000 PAGINAS",assets/images/products/toner/generic-box.png
BRDR229CL,toner,"TAMBOR BROTHER DR229CL NEGRO, 20.000 PAGINAS - 4 PIEZAS","TAMBOR BROTHER DR229CL NEGRO, 20.000 PAGINAS - 4 PIEZAS",assets/images/products/toner/generic-box.png
BRDR311CL,toner,TAMBOR BROTHER DR311CL NEGRO,TAMBOR BROTHER DR311CL NEGRO,assets/images/products/toner/generic-box.png
BRTN431BK,toner,TONER BROTHER ORIGINAL TN431 NEGRO,TONER BROTHER ORIGINAL TN431 NEGRO,assets/images/products/toner/generic-box.png
BRTN431C,toner,TONER BROTHER ORIGINAL TN431 CYAN,TONER BROTHER ORIGINAL TN431 CYAN,assets/images/products/toner/generic-box.png
BRTN431M,toner,TONER BROTHER ORIGINAL TN431 MAGENTA,TONER BROTHER ORIGINAL TN431 MAGENTA,assets/images/products/toner/generic-box.png
BRTN431Y,toner,TONER BROTHER ORIGINAL TN431 AMARILLO,TONER BROTHER ORIGINAL TN431 AMARILLO,assets/images/products/toner/generic-box.png
BRDR421CL,toner,TAMBOR BROTHER DR421CL NEGRO,TAMBOR BROTHER DR421CL NEGRO,assets/images/products/toner/generic-box.png
BRTN920,toner,"TONER BROTHER TN920 NEGRO, RENDIMIENTO 3,000 PAGINAS","TONER BROTHER TN920 NEGRO, RENDIMIENTO 3,000 PAGINAS",assets/images/products/toner/generic-box.png
BRTN920XXL,toner,"TONER BROTHER TN920XXL NEGRO, RENDIMIENTO 11,000 PAGINAS","TONER BROTHER TN920XXL NEGRO, RENDIMIENTO 11,000 PAGINAS",assets/images/products/toner/generic-box.png
BRDR221CL,toner,TAMBOR BROTHER DR221CL NEGRO,TAMBOR BROTHER DR221CL NEGRO,assets/images/products/toner/generic-box.png
BRDR520,toner,TAMBOR BROTHER DR520 NEGRO,TAMBOR BROTHER DR520 NEGRO,assets/images/products/toner/generic-box.png
BRDR250,toner,TAMBOR BROTHER DR250 NEGRO,TAMBOR BROTHER DR250 NEGRO,assets/images/products/toner/generic-box.png
BRDR450,toner,TAMBOR BROTHER DR450 NEGRO,TAMBOR BROTHER DR450 NEGRO,assets/images/products/toner/generic-box.png
BRDR330,toner,TAMBOR BROTHER DR330 NEGRO,TAMBOR BROTHER DR330 NEGRO,assets/images/products/toner/generic-box.png
BRDR720,toner,TAMBOR BROTHER DR720 NEGRO,TAMBOR BROTHER DR720 NEGRO,assets/images/products/toner/generic-box.png
